{
  "schemaVersion": "v1",
  "experimentId": "experiment_signal_trend_shadow",
  "hypothesisId": "hypothesis_signal_trend",
  "strategyKey": "trend_following",
  "status": "completed",
  "createdAt": "2026-03-10T14:10:00Z",
  "updatedAt": "2026-03-10T14:20:00Z",
  "completedAt": "2026-03-10T14:20:00Z",
  "venueKeys": ["jupiter"],
  "assetKeys": ["SOL", "USDC"],
  "sourceCitations": [
    {
      "sourceId": "source_paper_microstructure",
      "locator": "sec-2",
      "materialDigest": "sha256:citation"
    }
  ],
  "codeRevision": {
    "vcs": "git",
    "repository": "github.com/GuiBibeau/serious-trader-ralph",
    "revision": "356b539e3ec730663c4025b8f00cd6b47b823d1a",
    "comparedTo": "main~1",
    "treeDirty": false
  },
  "datasetSnapshots": [
    {
      "datasetId": "dataset_features_sol_usdc",
      "snapshotId": "snapshot_2026_03_10",
      "capturedAt": "2026-03-10T14:00:00Z",
      "uri": "r2://datasets/features/2026-03-10.parquet",
      "contentDigest": "sha256:dataset"
    }
  ],
  "artifacts": [
    {
      "artifactId": "replay-1",
      "kind": "replay-report",
      "uri": "r2://artifacts/replay-1.json",
      "contentDigest": "sha256:replay-1",
      "createdAt": "2026-03-10T14:20:00Z"
    }
  ],
  "summary": "Shadow replay passed the initial trigger-quality gate.",
  "tags": ["shadow"]
}
